{
  "version": "m3a-prototype-r4",
  "status": "Vertical map prototype for the estate screen (#375): the m3a-prototype-r2 economy and the r3 centre (r2 layout shifted by (26, 26)) unchanged, with the surrounding zones re-laid along the screen's vertical (grid u+v) like the approved key art A/C (m3-estate-keyarts-r2-20261024): north-east wood, west hill (quarry) and windmill above the centre; fields, village (river side), fallow, ruins and riverside below; the river along the right edge. Every axis-aligned zone projects to a 2:1 diamond, so the zones are staggered to keep the whole estate within the centre's width (u - v in -20..20) and 128 rows of u + v tall (1280x2048 at scale 1, about 1:1.6). Hypothesis values; not an economy decision (#126); not a release default. Only the village opens in this prototype; the other zones need 4 completed production sites, which this prototype (3 production kinds) cannot reach: a placeholder until exploration (M3c) opens them. m3a-prototype-r3 stays as it was.",
  "maximumIntervalSeconds": 604800,
  "initialWallet": {
    "meta:grain": 120,
    "meta:timber": 180,
    "meta:iron": 60,
    "meta:charter": 0
  },
  "walletCaps": {
    "meta:grain": 2000,
    "meta:timber": 2000,
    "meta:iron": 2000,
    "meta:charter": 100
  },
  "queue": {
    "reservations": 2,
    "autoStartDefault": false
  },
  "zones": [
    {
      "id": "zone:start",
      "x": 20,
      "y": 20,
      "width": 20,
      "height": 20,
      "openAtStart": true
    },
    {
      "id": "zone:inner-village",
      "x": 40,
      "y": 28,
      "width": 8,
      "height": 12,
      "openAtStart": false,
      "unlock": {
        "completedProductionSites": 2,
        "cost": {
          "meta:timber": 60
        },
        "seconds": 30
      }
    },
    {
      "id": "zone:inner-northeast-wood",
      "x": 0,
      "y": 0,
      "width": 20,
      "height": 10,
      "openAtStart": false,
      "unlock": {
        "completedProductionSites": 4,
        "cost": {
          "meta:timber": 60
        },
        "seconds": 30
      }
    },
    {
      "id": "zone:inner-west-hill",
      "x": 0,
      "y": 10,
      "width": 28,
      "height": 10,
      "openAtStart": false,
      "unlock": {
        "completedProductionSites": 4,
        "cost": {
          "meta:timber": 60
        },
        "seconds": 30
      }
    },
    {
      "id": "zone:inner-windmill",
      "x": 8,
      "y": 20,
      "width": 12,
      "height": 8,
      "openAtStart": false,
      "unlock": {
        "completedProductionSites": 4,
        "cost": {
          "meta:timber": 60
        },
        "seconds": 30
      }
    },
    {
      "id": "zone:inner-fields",
      "x": 32,
      "y": 40,
      "width": 8,
      "height": 12,
      "openAtStart": false,
      "unlock": {
        "completedProductionSites": 4,
        "cost": {
          "meta:timber": 60
        },
        "seconds": 30
      }
    },
    {
      "id": "zone:inner-fallow",
      "x": 40,
      "y": 40,
      "width": 10,
      "height": 20,
      "openAtStart": false,
      "unlock": {
        "completedProductionSites": 4,
        "cost": {
          "meta:timber": 60
        },
        "seconds": 30
      }
    },
    {
      "id": "zone:inner-ruins",
      "x": 50,
      "y": 40,
      "width": 10,
      "height": 20,
      "openAtStart": false,
      "unlock": {
        "completedProductionSites": 4,
        "cost": {
          "meta:timber": 60
        },
        "seconds": 30
      }
    },
    {
      "id": "zone:inner-riverside",
      "x": 60,
      "y": 48,
      "width": 8,
      "height": 12,
      "openAtStart": false,
      "unlock": {
        "completedProductionSites": 4,
        "cost": {
          "meta:timber": 60
        },
        "seconds": 30
      }
    }
  ],
  "storage": {
    "storageKind": "meta:granary",
    "granaryLevelSeconds": [
      7200,
      7200,
      10800,
      14400
    ],
    "longAwayBonusSeconds": 3600,
    "maximumSeconds": 18000,
    "baseStock": {
      "meta:grain": 720,
      "meta:timber": 480,
      "meta:iron": 240
    },
    "granaryLevelStockPermille": [
      1000,
      1000,
      1500,
      2000
    ],
    "longAwayStockPermille": 500,
    "maximumStockPermille": 2500,
    "longAwayBranch": "granary:long-away"
  },
  "production": {
    "parentLevelPermille": [
      0,
      1000,
      1250,
      1400
    ],
    "branchBonus": [
      {
        "branch": "forge:supply-workshop",
        "resource": "meta:iron",
        "permille": 200
      }
    ]
  },
  "construction": {
    "reductionBranch": "barracks:construction-support",
    "reductionPermille": 100,
    "maximumReductionPermille": 100
  },
  "buildings": [
    {
      "kind": "m3a:home",
      "x": 28,
      "y": 28,
      "width": 2,
      "height": 2,
      "startsComplete": true,
      "levels": []
    },
    {
      "kind": "meta:granary",
      "x": 26,
      "y": 26,
      "width": 2,
      "height": 2,
      "branches": [
        "granary:expedition-supply",
        "granary:long-away"
      ],
      "levels": [
        {
          "cost": {
            "meta:timber": 30
          },
          "seconds": 60
        },
        {
          "cost": {
            "meta:grain": 30,
            "meta:timber": 50,
            "meta:iron": 10
          },
          "seconds": 300
        },
        {
          "cost": {
            "meta:grain": 60,
            "meta:timber": 80,
            "meta:iron": 20
          },
          "seconds": 1200
        }
      ]
    },
    {
      "kind": "meta:forge",
      "x": 32,
      "y": 26,
      "width": 2,
      "height": 2,
      "branches": [
        "forge:sword-workshop",
        "forge:supply-workshop"
      ],
      "levels": [
        {
          "cost": {
            "meta:timber": 40,
            "meta:iron": 20
          },
          "seconds": 120
        },
        {
          "cost": {
            "meta:grain": 40,
            "meta:timber": 60,
            "meta:iron": 30
          },
          "seconds": 480
        },
        {
          "cost": {
            "meta:grain": 80,
            "meta:timber": 100,
            "meta:iron": 50
          },
          "seconds": 1800
        }
      ]
    },
    {
      "kind": "meta:scriptorium",
      "x": 28,
      "y": 32,
      "width": 2,
      "height": 2,
      "branches": [
        "scriptorium:card-research",
        "scriptorium:city-records"
      ],
      "levels": [
        {
          "cost": {
            "meta:timber": 30,
            "meta:iron": 10
          },
          "seconds": 180
        },
        {
          "cost": {
            "meta:grain": 40,
            "meta:timber": 60,
            "meta:iron": 20
          },
          "seconds": 600
        },
        {
          "cost": {
            "meta:grain": 80,
            "meta:timber": 100,
            "meta:iron": 40
          },
          "seconds": 2400
        }
      ]
    },
    {
      "kind": "meta:barracks",
      "x": 30,
      "y": 32,
      "width": 2,
      "height": 2,
      "branches": [
        "barracks:escort",
        "barracks:construction-support"
      ],
      "levels": [
        {
          "cost": {
            "meta:grain": 20,
            "meta:timber": 40,
            "meta:iron": 10
          },
          "seconds": 180
        },
        {
          "cost": {
            "meta:grain": 60,
            "meta:timber": 60,
            "meta:iron": 20
          },
          "seconds": 600
        },
        {
          "cost": {
            "meta:grain": 100,
            "meta:timber": 100,
            "meta:iron": 40
          },
          "seconds": 2400
        }
      ]
    },
    {
      "kind": "m3a:watchtower",
      "x": 32,
      "y": 32,
      "width": 2,
      "height": 2,
      "levels": [
        {
          "cost": {
            "meta:timber": 50,
            "meta:iron": 20
          },
          "seconds": 300
        },
        {
          "cost": {
            "meta:grain": 40,
            "meta:timber": 70,
            "meta:iron": 30
          },
          "seconds": 900
        },
        {
          "cost": {
            "meta:grain": 80,
            "meta:timber": 120,
            "meta:iron": 50
          },
          "seconds": 2700
        }
      ]
    },
    {
      "kind": "m3a:well_shrine",
      "x": 30,
      "y": 28,
      "width": 2,
      "height": 2,
      "levels": [
        {
          "cost": {
            "meta:timber": 40,
            "meta:iron": 10
          },
          "seconds": 300
        },
        {
          "cost": {
            "meta:grain": 40,
            "meta:timber": 60,
            "meta:iron": 20
          },
          "seconds": 900
        },
        {
          "cost": {
            "meta:grain": 80,
            "meta:timber": 100,
            "meta:iron": 40
          },
          "seconds": 2700
        }
      ]
    },
    {
      "kind": "m3a:field",
      "x": 26,
      "y": 30,
      "width": 2,
      "height": 2,
      "parent": "meta:granary",
      "produces": {
        "resource": "meta:grain",
        "perMinute": 6
      },
      "levels": [
        {
          "cost": {
            "meta:grain": 10,
            "meta:timber": 10
          },
          "seconds": 30
        }
      ]
    },
    {
      "kind": "m3a:lumber_camp",
      "x": 26,
      "y": 32,
      "width": 2,
      "height": 2,
      "parent": "meta:granary",
      "produces": {
        "resource": "meta:timber",
        "perMinute": 4
      },
      "levels": [
        {
          "cost": {
            "meta:grain": 10,
            "meta:iron": 5
          },
          "seconds": 30
        }
      ]
    },
    {
      "kind": "m3a:ironworks",
      "x": 32,
      "y": 28,
      "width": 2,
      "height": 2,
      "parent": "meta:forge",
      "produces": {
        "resource": "meta:iron",
        "perMinute": 2
      },
      "levels": [
        {
          "cost": {